{
  "schema": "agent-memory-staging-capacity-economics-input-v1",
  "classification": "staging_external",
  "environment": "staging",
  "assessment_id": "replace-with-assessment-id",
  "capacity_model_version": "replace-with-capacity-model-version",
  "entitlement_version": "replace-with-entitlement-version",
  "economics_version": "replace-with-economics-version",
  "beta_cap_version": "replace-with-beta-cap-version",
  "inventory_id": "replace-with-inventory-id",
  "inventory_receipt_sha256": "aaaaaaaaaaaaaaaaaaaaaaaaaaaaaaaaaaaaaaaaaaaaaaaaaaaaaaaaaaaaaaaa",
  "plan_id": "replace-with-plan-id",
  "plan_receipt_sha256": "bbbbbbbbbbbbbbbbbbbbbbbbbbbbbbbbbbbbbbbbbbbbbbbbbbbbbbbbbbbbbbbb",
  "change_id": "replace-with-change-id",
  "change_receipt_sha256": "cccccccccccccccccccccccccccccccccccccccccccccccccccccccccccccccc",
  "release_id": "replace-with-release-id",
  "release_receipt_sha256": "dddddddddddddddddddddddddddddddddddddddddddddddddddddddddddddddd",
  "retrieval_load_run_id": "replace-with-load-run-id",
  "retrieval_load_receipt_sha256": "eeeeeeeeeeeeeeeeeeeeeeeeeeeeeeeeeeeeeeeeeeeeeeeeeeeeeeeeeeeeeeee",
  "installed_launch_policy_sha256": "ffffffffffffffffffffffffffffffffffffffffffffffffffffffffffffffff",
  "entitlement_snapshot_sha256": "1111111111111111111111111111111111111111111111111111111111111111",
  "capacity_report_sha256": "2222222222222222222222222222222222222222222222222222222222222222",
  "economics_report_sha256": "3333333333333333333333333333333333333333333333333333333333333333",
  "decision_sha256": "4444444444444444444444444444444444444444444444444444444444444444",
  "decision_approved_at": "2026-08-10T10:00:00Z",
  "assessment_started_at": "2026-08-10T16:30:00Z",
  "assessment_completed_at": "2026-08-10T17:15:00Z",
  "generated_at": "2026-08-10T17:30:00Z",
  "beta_account_cap": 100,
  "planned_peak_concurrent_tenants": 30,
  "supported_concurrent_tenants": 40,
  "planned_peak_retrieval_requests_per_minute": 10000,
  "sustained_retrieval_requests_per_minute": 12000,
  "fixed_monthly_cost_microusd": 100000000,
  "variable_monthly_cost_per_tenant_microusd": 5000000,
  "estimated_worst_case_monthly_cost_microusd": 600000000,
  "approved_monthly_cost_ceiling_microusd": 750000000,
  "ready": true,
  "checks": [
    {"id": "beta_cap_approved", "outcome": "passed", "evidence_sha256": "5555555555555555555555555555555555555555555555555555555555555555"},
    {"id": "deployed_retrieval_load_ready", "outcome": "passed", "evidence_sha256": "6666666666666666666666666666666666666666666666666666666666666666"},
    {"id": "installed_capacity_measured", "outcome": "passed", "evidence_sha256": "7777777777777777777777777777777777777777777777777777777777777777"},
    {"id": "tenant_concurrency_headroom_met", "outcome": "passed", "evidence_sha256": "8888888888888888888888888888888888888888888888888888888888888888"},
    {"id": "retrieval_throughput_headroom_met", "outcome": "passed", "evidence_sha256": "9999999999999999999999999999999999999999999999999999999999999999"},
    {"id": "quota_envelope_reconciled", "outcome": "passed", "evidence_sha256": "0000000000000000000000000000000000000000000000000000000000000000"},
    {"id": "worst_case_economics_reconciled", "outcome": "passed", "evidence_sha256": "abababababababababababababababababababababababababababababababab"},
    {"id": "monthly_cost_ceiling_met", "outcome": "passed", "evidence_sha256": "cdcdcdcdcdcdcdcdcdcdcdcdcdcdcdcdcdcdcdcdcdcdcdcdcdcdcdcdcdcdcdcd"}
  ]
}
